{
  "name": "FanSpeed",
  "version": 1,
  "standard": true,
  "matterCluster": "FanControl",
  "attributes": [
    {"name": "level", "type": "integer", "min": 0, "step": 1, "readOnly": false},
    {"name": "auto", "type": "boolean", "readOnly": false}
  ],
  "commands": [
    {"name": "set", "sets": ["level", "auto"],
     "args": {"type": "object", "minProperties": 1, "additionalProperties": false,
              "properties": {
                "level": {"type": "integer", "minimum": 0},
                "auto": {"type": "boolean"}}}}
  ],
  "expectedEffects": []
}
