{
  "name": "Ventilation",
  "version": 1,
  "standard": true,
  "matterCluster": "FanControl",
  "attributes": [
    {"name": "mode", "type": "enum", "enum": ["off", "on", "auto"], "readOnly": false},
    {"name": "level", "type": "integer", "min": 1, "max": 3, "step": 1, "readOnly": false}
  ],
  "commands": [
    {"name": "set", "sets": ["mode", "level"],
     "args": {"type": "object", "minProperties": 1, "additionalProperties": false,
              "properties": {
                "mode": {"type": "string", "enum": ["off", "on", "auto"]},
                "level": {"type": "integer", "minimum": 1, "maximum": 3}}}}
  ],
  "expectedEffects": []
}
